{
  "version": "0.8.2",
  "revision": 1,
  "date": "2026-10-27",
  "title": "Выбор исполнителя для прогона",
  "items": [
    {
      "kind": "new",
      "screen": "/projects/[project_uid]/versions/[version_uid]",
      "where": "Работа › Версия документа › Прогоны",
      "text": "Рядом с кнопкой «Запустить прогон» появился выбор «Исполнитель». По умолчанию прогон идёт на исполнителе, назначенном для анализа текста. Можно выбрать другое подключение из списка: у каждого указаны вид, модель и результат последней проверки. Подключения, которые сейчас не могут выполнить прогон, показаны с причиной и недоступны для выбора."
    },
    {
      "kind": "new",
      "screen": "/projects/[project_uid]/versions/[version_uid]",
      "where": "Работа › Версия документа › Прогоны",
      "text": "Если выбранный исполнитель не может выполнить прогон, запуск отклоняется с сообщением на русском языке. Система не подставляет другого исполнителя и не предлагает запуск по умолчанию: решение остаётся за вами."
    },
    {
      "kind": "new",
      "screen": "/projects/[project_uid]/runs/[run_id]",
      "where": "Работа › Прогон",
      "text": "На странице прогона и в списке прогонов указаны исполнитель и его модель. Если прогон стоит в очереди, написано «Ждёт исполнителя» и название исполнителя. В журнале выполнения запись «Выбран исполнитель» показывает, что исполнителя назвали при запуске."
    },
    {
      "kind": "improved",
      "screen": "/queue",
      "where": "Система › Очередь",
      "text": "Повторный аудит прогона, который шёл на выбранном исполнителе, остаётся на нём. Если этот исполнитель больше не может выполнить прогон, повторный аудит отклоняется, а не переносится на другого."
    },
    {
      "kind": "improved",
      "screen": "/queue",
      "where": "Система › Очередь",
      "text": "Для одного исполнителя одновременно идёт один прогон, следующий ждёт в очереди и не занимает место других. Прогоны для разных исполнителей могут идти одновременно, если администратор разрешил несколько одновременных прогонов; по умолчанию идёт один."
    }
  ]
}
