{
  "version": "0.4.0",
  "revision": 1,
  "date": "2026-10-12",
  "title": "Очередь, журнал выполнения и управление прогонами",
  "items": [
    {
      "kind": "new",
      "screen": "/queue",
      "where": "Система › Очередь",
      "text": "Очередь показывает задания анализа по приоритету. Эксперт или администратор может отменить прогон или запустить повторный аудит, который создаёт новый прогон на текущих настройках."
    },
    {
      "kind": "new",
      "screen": "/logs",
      "where": "Система › Журнал выполнения",
      "text": "Журнал выполнения показывает шаги каждого прогона: постановку в очередь, попытки, отмену и повторный аудит."
    },
    {
      "kind": "new",
      "screen": "/queue",
      "where": "Система › Очередь",
      "text": "Администратор может менять приоритет заданий и приостанавливать выдачу новых заданий."
    },
    {
      "kind": "improved",
      "screen": "/",
      "where": "Главная",
      "text": "Прогоны продолжаются после перезапуска сервиса: незавершённая работа возвращается в очередь, а уже оплаченные обращения к модели не повторяются."
    },
    {
      "kind": "improved",
      "screen": "/",
      "where": "Главная",
      "text": "Учётная запись без ролей больше не видит данные проектов; на главной странице сказано, что роли не назначены."
    },
    {
      "kind": "fixed",
      "screen": "/account",
      "where": "Профиль",
      "text": "После сохранения профиля имя и меню в шапке обновляются сразу, без перезагрузки страницы."
    },
    {
      "kind": "fixed",
      "screen": "/login",
      "where": "Вход",
      "text": "Со страницы входа можно перейти к заявке на доступ."
    }
  ]
}
