{
  "version": "0.7.0",
  "revision": 2,
  "date": "2026-10-21",
  "title": "Разделы, сравнение версий, диспетчер, оптимизация и нормы",
  "items": [
    {
      "kind": "new",
      "screen": "/projects/[project_uid]/versions/[version_uid]",
      "where": "Работа › Версия документа › Стадия и раздел",
      "text": "Эксперт подтверждает стадию версии (П или Р) и один из 15 разделов, а позже исправляет подтверждение кнопкой «Исправить» с причиной; история исправлений видна. Прогон идёт по профилю подтверждённого раздела; без подтверждённого раздела (так и у версий, загруженных раньше) или для раздела без профиля (ПБ) он отклоняется. Проект группирует документы по разделам. Профили 13 разделов — черновики."
    },
    {
      "kind": "new",
      "screen": "/projects/[project_uid]/versions/[version_uid]/comparison",
      "where": "Работа › Сравнение прогонов › Сравнение версий",
      "text": "Следующую версию документа загружают кнопкой «Загрузить новую версию» на странице документа; раздел для неё подтверждают заново. «Сравнение версий» сопоставляет листы и строки двух проанализированных версий одной стадии и раздела, а режим «Стадии П → Р» — версию П с более поздней Р. Эксперт кнопкой «Перенести решение» переносит решение по замечанию на то же неизменившееся замечание новой версии."
    },
    {
      "kind": "new",
      "screen": "/dispatcher",
      "where": "Работа › Диспетчер",
      "text": "Администратор назначает проект или один из его документов эксперту, переназначает и отменяет работу. Эксперт берёт её в работу, отмечает выполненной или возвращает с причиной — в «Диспетчере» и в блоке «Мои задачи» на главной странице. Каждое изменение остаётся в истории назначения."
    },
    {
      "kind": "new",
      "screen": "/projects/[project_uid]",
      "where": "Работа › Проект › Оптимизация",
      "text": "На вкладке «Оптимизация» эксперт загружает прайс-лист (CSV или Excel), администратор ведёт вендор-листы по разделам, эксперт — свои для проекта. «Спецификация и цены» сопоставляет строки спецификации АР с прайс-листом: цена и сумма только у однозначных строк. «Предложения» по кнопке «Запустить проход» находят более дешёвые позиции от поставщиков вендор-листа АР; эксперт принимает или отклоняет их."
    },
    {
      "kind": "new",
      "screen": "/section-optimisation",
      "where": "Работа › Оптимизация разделов",
      "text": "«Оптимизация разделов» показывает спецификацию выбранного раздела по всем проектам, где текущая версия документа подтверждена в этом разделе. Строки разных проектов не смешиваются: каждая оценена по прайс-листу своего проекта, итоги даны по проектам и валютам, общего итога по разделу нет."
    },
    {
      "kind": "new",
      "screen": "/norms",
      "where": "Знания › Нормы",
      "text": "В «Нормах» появился «Каталог» документов текущего снимка: поиск по обозначению и названию и отбор по виду; для части документов обозначения стали читаемыми, например «СП 54.13330.2022». На странице завершённого прогона «Нормативные ссылки» сверяют упомянутые в тексте нормы со снимком прогона. Нужен загруженный снимок, назначенный администратором текущим; у прогона, начатого раньше, ссылок нет."
    },
    {
      "kind": "new",
      "screen": "/projects/[project_uid]/runs/[run_id]/review",
      "where": "Работа › Разбор находок",
      "text": "В «Разборе находок» рядом с выгрузкой в CSV появилась кнопка «Скачать Excel»: книга с замечаниями прогона, где категория и решение эксперта названы теми же словами, что на экране. Книга не строится для версии без комплекта портала распознавания и для прогона без результата. В CSV добавлены две колонки серьёзности; они пусты, пока серьёзность не определена."
    }
  ]
}
