{
  "version": "0.2.0",
  "revision": 2,
  "date": "2026-10-07",
  "title": "Прототип и ранняя альфа",
  "is_archive": true,
  "range_label": "0.1–0.2",
  "items": [
    {
      "kind": "new",
      "screen": "/",
      "where": "Главная",
      "text": "Ранние версии объединили работу с документом, разбор находок и решение эксперта."
    }
  ]
}
