{
  "version": "0.5.1",
  "revision": 1,
  "date": "2026-10-14",
  "title": "Оформление истории версий, входа и списка пользователей",
  "items": [
    {
      "kind": "improved",
      "screen": "/",
      "where": "Главная",
      "text": "«История версий» открывается боковой панелью с лентой выпусков: у каждой версии номер и дата, у каждого изменения — цветная метка вида и раздел, к которому оно относится. Панель закрывается крестиком в заголовке."
    },
    {
      "kind": "improved",
      "screen": "/login",
      "where": "Вход",
      "text": "Страница входа стала компактной карточкой по центру экрана: поля и кнопка «Войти» во всю ширину, сообщение о неудачном входе — над полями, ссылка «Подать заявку на доступ» — под карточкой."
    },
    {
      "kind": "improved",
      "screen": "/admin/users",
      "where": "Администрирование › Пользователи",
      "text": "Фильтры «Включить архивные» и «Роль на текущей странице» стоят на одной линии, а список ролей стал компактнее."
    },
    {
      "kind": "improved",
      "screen": "/",
      "where": "Главная",
      "text": "В тёмной теме флажки, раскрывающиеся списки, полосы прокрутки и поля, заполненные браузером автоматически, тоже тёмные, без светлых пятен."
    },
    {
      "kind": "fixed",
      "screen": "/login",
      "where": "Вход",
      "text": "Поле пароля на страницах входа, регистрации и смены пароля выглядит так же, как остальные поля, а не узкой полосой без рамки."
    }
  ]
}
