{
  "version": "0.3.0",
  "revision": 2,
  "date": "2026-10-08",
  "title": "История изменений и новые разделы",
  "items": [
    {
      "kind": "new",
      "screen": "/",
      "where": "Главная",
      "text": "История версий открывается из меню профиля и показывает изменения по датам."
    },
    {
      "kind": "new",
      "screen": "/admin/registrations",
      "where": "Администрирование › Заявки на регистрацию",
      "text": "Администратор может одобрить заявку на регистрацию с назначением роли или отклонить её с причиной."
    },
    {
      "kind": "new",
      "screen": "/admin/users",
      "where": "Администрирование › Пользователи",
      "text": "Администратор видит список пользователей и может изменить роли учётной записи."
    },
    {
      "kind": "improved",
      "screen": "/projects",
      "where": "Работа › Проекты",
      "text": "Раздел проектов находится в группе «Работа» вместе с дашбордом."
    }
  ]
}
