{
  "version": "0.5.0",
  "revision": 1,
  "date": "2026-10-13",
  "title": "Исполнители и отдельная служба выполнения прогонов",
  "items": [
    {
      "kind": "new",
      "screen": "/workers",
      "where": "Система › Исполнители",
      "text": "Раздел «Исполнители» показывает процессы, которые выполняют прогоны: на связи ли исполнитель, сколько прогонов он ведёт одновременно, его версию, время запуска, последний отклик и текущие прогоны. Отключённые исполнители собраны в свёрнутый список."
    },
    {
      "kind": "new",
      "screen": "/workers",
      "where": "Система › Исполнители",
      "text": "Администратор может запретить исполнителю брать новые задания и снова разрешить это. Команда отправляется только после подтверждения; начатые прогоны исполнитель доводит до конца."
    },
    {
      "kind": "new",
      "screen": "/queue",
      "where": "Система › Очередь",
      "text": "Очередь и страница прогона показывают, какой исполнитель сейчас ведёт прогон, со ссылкой на раздел «Исполнители»."
    },
    {
      "kind": "improved",
      "screen": "/",
      "where": "Главная",
      "text": "Прогоны выполняет отдельная служба исполнителей, а не веб-приложение. Новое задание исполнитель берёт в течение нескольких секунд после постановки в очередь."
    },
    {
      "kind": "improved",
      "screen": "/queue",
      "where": "Система › Очередь",
      "text": "При плановом перезапуске исполнитель перестаёт брать новые задания и даёт начатым прогонам до четырёх с половиной минут на завершение."
    },
    {
      "kind": "improved",
      "screen": "/queue",
      "where": "Система › Очередь",
      "text": "Прогоны исполнителя, который перестал отвечать, автоматически возвращаются в очередь, и их подхватывает исполнитель на связи; уже оплаченные обращения к модели не повторяются."
    },
    {
      "kind": "fixed",
      "screen": "/",
      "where": "Главная",
      "text": "Долгая заключительная проверка прогона больше не приводит к потере уже полученного ответа модели."
    }
  ]
}
