{
  "version": "0.8.0",
  "revision": 1,
  "date": "2026-10-23",
  "title": "Карта тем АР v3 для предварительной проверки",
  "items": [
    {
      "kind": "new",
      "screen": "/analysis-settings",
      "where": "Система › Настройки анализа",
      "text": "В «Настройках анализа» показана карта 22 тем АР v3 для нового многоквартирного дома: 14 предварительных ссылок и 8 контекстных пунктов. Каждый требует проверки эксперта. Прогоны v3 и числовые выводы пока недоступны."
    }
  ]
}
