{
  "version": "0.6.0",
  "revision": 1,
  "date": "2026-10-15",
  "title": "Комплекты портала распознавания, блоки и распознанный текст",
  "items": [
    {
      "kind": "new",
      "screen": "/projects/[project_uid]",
      "where": "Работа › Проект",
      "text": "Документ загружается комплектом, который формирует портал распознавания: одним архивом с самим документом, файлом блоков и файлом распознанного текста. В документе может быть до 500 страниц, архив может занимать до 250 МиБ; прежде пределы были 30 страниц и 25 МиБ. Отдельный документ без комплекта не принимается, и форма загрузки говорит, что загрузить вместо него."
    },
    {
      "kind": "new",
      "screen": "/blocks",
      "where": "Знания › Блоки",
      "text": "«Блоки» открываются на вкладке «Блоки портала»: блоки версии по страницам — текст, изображения и штампы. Для изображения показан фрагмент страницы, который система вырезала из документа сама. Блоки появляются после первого прогона анализа версии; у версий, загруженных раньше без комплекта, их нет. Прежний список строк остался на вкладке «Строки текста»."
    },
    {
      "kind": "new",
      "screen": "/blocks",
      "where": "Знания › Блоки",
      "text": "Текст, распознанный порталом, помечен «распознано», и при нём показаны признаки качества, например «смешение кириллицы и латиницы» или «пустой текст». Описания изображений от портала помечены «описание портала — в анализе не используется». Анализ по-прежнему читает только встроенный текст документа: распознанный текст, описания и фрагменты изображений в него не передаются."
    },
    {
      "kind": "new",
      "screen": "/projects/[project_uid]/versions/[version_uid]",
      "where": "Работа › Версия документа",
      "text": "Один прогон анализа принимает текст не больше установленного объёма. Если текст версии больше, запуск прогона и «Повторный аудит» в очереди отклоняются сразу, и новый прогон не создаётся; сообщение называет оба числа: сколько символов в тексте версии и сколько допустимо. Блоки портала строит прогон, поэтому у такой версии они не появятся."
    },
    {
      "kind": "improved",
      "screen": "/projects/[project_uid]",
      "where": "Работа › Проект",
      "text": "Комплект проверяется при загрузке целиком. При отказе форма загрузки теперь называет нарушенное правило, например о составе архива, размере, числе страниц или тексте на страницах; те же правила перечислены в форме до выбора файла."
    },
    {
      "kind": "improved",
      "screen": "/projects/[project_uid]",
      "where": "Работа › Проект",
      "text": "Страница без встроенного текста, например отсканированная, принимается, если портал распознал на ней хотя бы один блок; её распознанный текст виден в «Блоках». Страница без встроенного текста и без блока портала по-прежнему отклоняется."
    }
  ]
}
