{
  "version": "0.8.1",
  "revision": 1,
  "date": "2026-10-26",
  "title": "Статус пакета АР v3 и запуск шести проверок",
  "items": [
    {
      "kind": "new",
      "screen": "/analysis-settings",
      "where": "Система › Настройки анализа",
      "text": "«Настройки анализа» показывают, установлен ли пакет проверенных норм АР v3. Если установлен, видны профиль анализа, шесть областей проверок и запись рецензента: рецензент, в качестве кого, дата, ссылка на решение и что именно рецензировано; система эту запись не проверяет. Если не установлен, сказано, что запуск шести проверок недоступен."
    },
    {
      "kind": "new",
      "screen": "/projects/[project_uid]/versions/[version_uid]",
      "where": "Работа › Версия документа › Прогоны",
      "text": "Если пакет установлен, в списке прогонов версии рядом с «Запустить прогон» есть кнопка «Запустить шесть проверок АР v3»: она создаёт шесть отдельных прогонов и открывает их разбор в «Настройках анализа». Результат — предварительные цитаты для проверки экспертом, без числовых выводов. Без пакета кнопки нет."
    },
    {
      "kind": "new",
      "screen": "/analysis-settings",
      "where": "Система › Настройки анализа › Разбор группы прогонов",
      "text": "В «Настройках анализа» появился блок «АР v3: разбор группы прогонов». По идентификатору группы из ответа запуска он показывает все шесть прогонов с состоянием каждого и, когда они готовы, предварительные цитаты проекта и норм. Каждая тема и цитата требует проверки эксперта; числовых и правовых выводов здесь нет."
    },
    {
      "kind": "improved",
      "screen": "/projects/[project_uid]/runs/[run_id]",
      "where": "Работа › Прогон › Разбор",
      "text": "На странице прогона АР v3 вместо «Разобрать находки» сказано, что канонических находок здесь нет, и дано указание открыть «Настройки анализа» и ввести идентификатор группы из ответа запуска. Завершённый прогон сообщает, что сохранён предварительный нормативный разбор, а частичный — что полный результат не подтверждён."
    },
    {
      "kind": "improved",
      "screen": "/projects/[project_uid]/runs/[run_id]/review",
      "where": "Работа › Разбор находок › Цитаты",
      "text": "Под каждой цитатой указана только страница, например «стр. 7». Диапазон символов «по всему документу» показан лишь в предупреждении о несовпадении длины фрагмента с цитатой."
    },
    {
      "kind": "fixed",
      "screen": "/analysis-settings",
      "where": "Система › Настройки анализа",
      "text": "Рамки карточек и линии между строками на экранах «Настройки анализа», «Очередь», «Исполнители», «Журнал выполнения», «Заявки на регистрацию» и на вкладке «Оптимизация» проекта рисовались цветом текста. Теперь это линии цветов темы, контраст не ниже 3:1 в светлой и тёмной теме."
    },
    {
      "kind": "fixed",
      "screen": "/projects/[project_uid]/versions/[version_uid]",
      "where": "Работа › Версия документа › История классификации",
      "text": "В «Истории классификации» версии между записями появился промежуток: раньше они стояли вплотную друг к другу."
    }
  ]
}
