{
  "version": "0.9.0",
  "revision": 2,
  "date": "2026-10-28",
  "title": "Разделы анализа, большие документы и сравнение листов",
  "items": [
    {
      "kind": "new",
      "screen": "/projects/[project_uid]/versions/[version_uid]/comparison",
      "where": "Работа › Сравнение прогонов › Сравнение версий › Сопоставление листов (предложение) › Подтверждение эксперта",
      "text": "Эксперт кнопкой «Подтвердить пару» подтверждает пару листов, кнопкой «Отозвать» отзывает её. Раздел «Подтверждённые пары листов» показывает строки, добавленные и удалённые в таких парах, пересчитанные без участия ИИ. Если изменился текст листа хотя бы одной подтверждённой пары, различия не показываются ни для одной: пару отзывают и подтверждают заново. Без роли эксперта кнопок нет."
    },
    {
      "kind": "new",
      "screen": "/projects/[project_uid]/versions/[version_uid]/comparison",
      "where": "Работа › Сравнение прогонов › Сравнение версий › Сводка по подтверждённым парам",
      "text": "Сводка пока работает только на записанных образцах: в сборке одна синтетическая запись, а для пар документов проекта кнопка «Подготовить сводку» оканчивается отказом: записанного ответа нет, модель для сводок не подключена. Если запись есть, сводка готовится с пометкой «Сводка подготовлена моделью, проверка человеком не проводилась» и ссылками «лист X → лист Y, изменение N»; различия не меняет."
    },
    {
      "kind": "improved",
      "screen": "/analysis-settings",
      "where": "Система › Настройки анализа",
      "text": "У профилей анализа 14 разделов, кроме АР, версия 1.1.0 или 1.2.0 и состояние «проверен» вместо «черновик, требует экспертной проверки». Для 12 разделов добавлены сверки внутри документа, например итога таблицы с суммой строк: о расхождении модель просят сообщить в категории «Внутреннее противоречие» с цитатами. Ни человек, ни реальные документы эти инструкции для модели не проверяли."
    },
    {
      "kind": "improved",
      "screen": "/projects/[project_uid]/versions/[version_uid]",
      "where": "Работа › Версия документа › Прогоны",
      "text": "Версию с очень большим текстом (кроме АР) больше не отклоняют сразу, когда текст не помещается в одно обращение к модели: он делится на окна из целых страниц, до двенадцати. Каждое окно анализируется отдельно, расхождение между окнами не находят. Окна не делают разбор дешевле: потолок стоимости общий на весь прогон, и когда он исчерпан, прогон останавливается без находок."
    },
    {
      "kind": "improved",
      "screen": "/projects/[project_uid]",
      "where": "Работа › Проект › Оптимизация",
      "text": "«Спецификация и цены» и «Предложения» строятся для комплекта, текущая версия которого подтверждена в любом из 15 разделов, не только в АР; в списке указан раздел. Проходу нужен вендор-лист раздела. Чтение спецификации других разделов на реальных документах не проверялось. На экране «Работа › Дашборд» исправлено пояснение к «Без раздела»: документ стоит там, пока эксперт не подтвердил раздел."
    },
    {
      "kind": "improved",
      "screen": "/projects/[project_uid]/versions/[version_uid]",
      "where": "Работа › Версия документа › Прогоны",
      "text": "Прежний анализ АР убран: обычного запуска у версии АР нет, обычный прогон по ней отклоняется. Анализ АР идёт только шестью проверками АР v3: кнопка есть, если на сервере установлен пакет норм АР v3, иначе экран объясняет, почему запуска нет. В «Настройках анализа» у АР написано «текстовый профиль не используется»."
    },
    {
      "kind": "improved",
      "screen": "/workers",
      "where": "Система › Исполнители",
      "text": "Подключение вида «Команда по SSH» можно назначить и выбрать в списке «Исполнитель», если у него есть ключ и успешная проверка; раньше карточка писала «этот вид подключения пока не обслуживается». Адрес с http:// принимается только для адреса этой же машины и, при связи через VPN, для частного; для остальных нужен https://. Ранее сохранённое подключение с публичным http:// больше не используется."
    }
  ]
}
